[
  {
    "id": "competitor-post-bb29efa08eb7",
    "handle_id": "handle-dfc366e1fe2f",
    "platform": "tiktok",
    "platform_post_id": "7643214827690806541",
    "post_url": "https://www.tiktok.com/@dinklygame/video/7643214827690806541",
    "caption": "#couples #relationships #soulmate #longdistance ",
    "hashtags": [
      "couples",
      "relationships",
      "soulmate",
      "longdistance"
    ],
    "posted_at": "2026-05-23T22:17:37.000Z",
    "media_type": "unknown",
    "thumbnail_path": null,
    "remote_thumbnail_url": "https://p19-common-sign.tiktokcdn-us.com/tos-useast5-i-photomode-tx/c65389f3ee7745178284025c0ca6512e~tplv-photomode-image.jpeg?dr=9616&x-expires=1786226400&x-signature=UNXWstBaS4eVnX7V7eRjI8ib0LM%3D&t=4d5b0474&ps=13740610&shp=81f88b70&shcp=9b759fb9&idc=useast5&ftpl=1",
    "media_url": null,
    "carousel_item_count": null,
    "duration_seconds": null,
    "view_count": 5000000,
    "like_count": 399600,
    "comment_count": 1002,
    "share_count": 267900,
    "audio_name": "som original",
    "creative_attributes": {
      "format": null,
      "theme": "companionship",
      "activity": null,
      "setting": null,
      "hook": "#couples #relationships #soulmate #longdistance ",
      "text_on_screen": null,
      "caption_style": "short",
      "camera_angle": null,
      "visual_density": null,
      "prop_count": null,
      "character_count": null,
      "physical_closeness": null,
      "emotional_tone": "companionship",
      "color_family": null,
      "single_panel_or_split": null,
      "trend_reference": null,
      "brand_presence": null,
      "notes": "Partial classification from caption and hashtags only; no full video narrative was inferred.",
      "classification_source": "local public-metadata classifier",
      "classification_confidence": "low",
      "classification_partial": true,
      "input_sources_used": [
        "caption",
        "hashtags"
      ],
      "uncertainties": [
        "Visual attributes were not inspected.",
        "Video narrative was not analyzed."
      ]
    },
    "first_seen_at": "2026-08-06T22:44:31.566414+00:00",
    "last_seen_at": "2026-08-06T22:44:31.566414+00:00",
    "provider": "apify",
    "raw_metadata": {
      "provider_item_keys": [
        "authorMeta",
        "collectCount",
        "commentCount",
        "commentsDatasetUrl",
        "createTime",
        "createTimeISO",
        "detailedMentions",
        "diggCount",
        "effectStickers",
        "fromProfileSection",
        "hashtags",
        "id",
        "input",
        "isAd",
        "isPinned",
        "isSlideshow",
        "isSponsored",
        "mediaUrls",
        "mentions",
        "musicMeta",
        "playCount",
        "repostCount",
        "shareCount",
        "shortDramaSeriesInfo",
        "slideshowImageLinks",
        "text",
        "textLanguage",
        "videoMeta",
        "webVideoUrl"
      ],
      "provider": "apify"
    }
  },
  {
    "id": "competitor-post-99ac88760bf2",
    "handle_id": "handle-dfc366e1fe2f",
    "platform": "tiktok",
    "platform_post_id": "7643445500817050893",
    "post_url": "https://www.tiktok.com/@dinklygame/video/7643445500817050893",
    "caption": "#relationshipgoals #couples #cartoons #sundayfunday ",
    "hashtags": [
      "relationshipgoals",
      "couples",
      "cartoons",
      "sundayfunday"
    ],
    "posted_at": "2026-05-24T13:13:25.000Z",
    "media_type": "unknown",
    "thumbnail_path": null,
    "remote_thumbnail_url": "https://p16-common-sign.tiktokcdn-us.com/tos-useast5-i-photomode-tx/b049421069414d3f9e2163bd09c18718~tplv-photomode-image.jpeg?dr=9616&x-expires=1786226400&x-signature=0lai%2FThWH15m6vvWJ1yy%2BL5TvEg%3D&t=4d5b0474&ps=13740610&shp=81f88b70&shcp=9b759fb9&idc=useast5&ftpl=1",
    "media_url": null,
    "carousel_item_count": null,
    "duration_seconds": null,
    "view_count": 4800000,
    "like_count": 297300,
    "comment_count": 717,
    "share_count": 315700,
    "audio_name": "original sound - R3troLyrics",
    "creative_attributes": {
      "format": null,
      "theme": "companionship",
      "activity": null,
      "setting": null,
      "hook": "#relationshipgoals #couples #cartoons #sundayfunday ",
      "text_on_screen": null,
      "caption_style": "short",
      "camera_angle": null,
      "visual_density": null,
      "prop_count": null,
      "character_count": null,
      "physical_closeness": null,
      "emotional_tone": "companionship",
      "color_family": null,
      "single_panel_or_split": null,
      "trend_reference": null,
      "brand_presence": null,
      "notes": "Partial classification from caption and hashtags only; no full video narrative was inferred.",
      "classification_source": "local public-metadata classifier",
      "classification_confidence": "low",
      "classification_partial": true,
      "input_sources_used": [
        "caption",
        "hashtags"
      ],
      "uncertainties": [
        "Visual attributes were not inspected.",
        "Video narrative was not analyzed."
      ]
    },
    "first_seen_at": "2026-08-06T22:44:31.579516+00:00",
    "last_seen_at": "2026-08-06T22:44:31.579516+00:00",
    "provider": "apify",
    "raw_metadata": {
      "provider_item_keys": [
        "authorMeta",
        "collectCount",
        "commentCount",
        "commentsDatasetUrl",
        "createTime",
        "createTimeISO",
        "detailedMentions",
        "diggCount",
        "effectStickers",
        "fromProfileSection",
        "hashtags",
        "id",
        "input",
        "isAd",
        "isPinned",
        "isSlideshow",
        "isSponsored",
        "mediaUrls",
        "mentions",
        "musicMeta",
        "playCount",
        "repostCount",
        "shareCount",
        "shortDramaSeriesInfo",
        "slideshowImageLinks",
        "text",
        "textLanguage",
        "videoMeta",
        "webVideoUrl"
      ],
      "provider": "apify"
    }
  },
  {
    "id": "competitor-post-d8f415066a6e",
    "handle_id": "handle-dfc366e1fe2f",
    "platform": "tiktok",
    "platform_post_id": "7635042101931101454",
    "post_url": "https://www.tiktok.com/@dinklygame/video/7635042101931101454",
    "caption": "#couples #relationshipgoals #loveyou #cartoons",
    "hashtags": [
      "couples",
      "relationshipgoals",
      "loveyou",
      "cartoons"
    ],
    "posted_at": "2026-05-01T21:43:10.000Z",
    "media_type": "unknown",
    "thumbnail_path": null,
    "remote_thumbnail_url": "https://p19-common-sign.tiktokcdn-us.com/tos-useast5-i-photomode-tx/4c402d48128346e9a5d43ccc6667a177~tplv-photomode-image.jpeg?dr=9616&x-expires=1786226400&x-signature=qTwv3SJa%2Fv2XtL70H6C2%2BCVmYCA%3D&t=4d5b0474&ps=13740610&shp=81f88b70&shcp=9b759fb9&idc=useast5&ftpl=1",
    "media_url": null,
    "carousel_item_count": null,
    "duration_seconds": null,
    "view_count": 2800000,
    "like_count": 238700,
    "comment_count": 548,
    "share_count": 203400,
    "audio_name": "original sound - R3troLyrics",
    "creative_attributes": {
      "format": null,
      "theme": "companionship",
      "activity": null,
      "setting": null,
      "hook": "#couples #relationshipgoals #loveyou #cartoons",
      "text_on_screen": null,
      "caption_style": "short",
      "camera_angle": null,
      "visual_density": null,
      "prop_count": null,
      "character_count": null,
      "physical_closeness": null,
      "emotional_tone": "companionship",
      "color_family": null,
      "single_panel_or_split": null,
      "trend_reference": null,
      "brand_presence": null,
      "notes": "Partial classification from caption and hashtags only; no full video narrative was inferred.",
      "classification_source": "local public-metadata classifier",
      "classification_confidence": "low",
      "classification_partial": true,
      "input_sources_used": [
        "caption",
        "hashtags"
      ],
      "uncertainties": [
        "Visual attributes were not inspected.",
        "Video narrative was not analyzed."
      ]
    },
    "first_seen_at": "2026-08-06T22:44:31.588929+00:00",
    "last_seen_at": "2026-08-06T22:44:31.588929+00:00",
    "provider": "apify",
    "raw_metadata": {
      "provider_item_keys": [
        "authorMeta",
        "collectCount",
        "commentCount",
        "commentsDatasetUrl",
        "createTime",
        "createTimeISO",
        "detailedMentions",
        "diggCount",
        "effectStickers",
        "fromProfileSection",
        "hashtags",
        "id",
        "input",
        "isAd",
        "isPinned",
        "isSlideshow",
        "isSponsored",
        "mediaUrls",
        "mentions",
        "musicMeta",
        "playCount",
        "repostCount",
        "shareCount",
        "shortDramaSeriesInfo",
        "slideshowImageLinks",
        "text",
        "textLanguage",
        "videoMeta",
        "webVideoUrl"
      ],
      "provider": "apify"
    }
  },
  {
    "id": "competitor-post-16a452b909a7",
    "handle_id": "handle-dfc366e1fe2f",
    "platform": "tiktok",
    "platform_post_id": "7670968901857004813",
    "post_url": "https://www.tiktok.com/@dinklygame/video/7670968901857004813",
    "caption": "you’re my favorite person 🫶\n\n#couplegoals #relationships #soulmate #loveyou #lovestory",
    "hashtags": [
      "couplegoals",
      "relationships",
      "soulmate",
      "loveyou",
      "lovestory"
    ],
    "posted_at": "2026-08-06T17:17:21.000Z",
    "media_type": "unknown",
    "thumbnail_path": null,
    "remote_thumbnail_url": "https://p19-common-sign.tiktokcdn-us.com/tos-useast5-p-0068-tx/oAeDKGqQpNRDJBmggZS0MfEwFEARjDd0cSNTbQ~tplv-tiktokx-origin.image?dr=9636&x-expires=1786226400&x-signature=WWkLl5Yd8fmf%2FeqaBlDThInBJqE%3D&t=4d5b0474&ps=13740610&shp=81f88b70&shcp=43f4a2f9&idc=useast5",
    "media_url": null,
    "carousel_item_count": null,
    "duration_seconds": null,
    "view_count": 1361,
    "like_count": 81,
    "comment_count": 2,